year,film,producers,year_raw,ceremony_year_raw,film_release_year,ceremony_number,winner_flag,film_clean,lookup_year,omdb_title,omdb_year,released,runtime,genre,director,writer,actors,plot,language,country,awards,poster,metascore,imdb_rating,imdb_votes,box_office,production,response_flag,error_msg,released_dt,release_month,release_year_omdb,runtime_min,imdb_rating_num,metascore_num,imdb_votes_num,box_office_num
1962.0,To Kill a Mockingbird,Alan J. Pakula,1962 (35th),1962 (35th),1962.0,35.0,,To Kill a Mockingbird,1962.0,To Kill a Mockingbird,1962,16 Mar 1963,129 min,"Crime, Drama",Robert Mulligan,"Harper Lee, Horton Foote","Gregory Peck, John Megna, Frank Overton",A widowed lawyer in Depression-era Alabama defends a black man against a false rape charge while teaching his young children about the sad reality of prejudice.,English,United States,Won 3 Oscars. 14 wins & 16 nominations total,https://m.media-amazon.com/images/M/MV5BZTlkYWU4MGEtZmQyYi00OWEzLTgzY2EtYzVjOTEzYzAyNTk1XkEyXkFqcGc@._V1_SX300.jpg,88,8.2,"350,117","$592,237",N/A,True,,1963-03-16,3.0,1963.0,129.0,8.2,88.0,350117.0,592237.0
1963.0,Tom Jones,Tony Richardson,1963 (36th),1963 (36th),1963.0,36.0,,Tom Jones,1963.0,Tom Jones,1963,27 Jun 1963,129 min,"Adventure, Comedy, History",Tony Richardson,"John Osborne, Henry Fielding","Albert Finney, Susannah York, George Devine",The romantic and chivalrous adventures of adopted bastard Tom Jones in 18th-century England.,English,United Kingdom,Won 4 Oscars. 20 wins & 20 nominations total,https://m.media-amazon.com/images/M/MV5BYjhlZTc4OWUtZGVjMC00NjA0LWEwNTQtMjUzNWQ5MjE0M2U5XkEyXkFqcGc@._V1_SX300.jpg,77,6.4,"15,250",N/A,N/A,True,,1963-06-27,6.0,1963.0,129.0,6.4,77.0,15250.0,
1963.0,America America,Elia Kazan,1963 (36th),1963 (36th),1963.0,36.0,,America America,1963.0,America America,1963,17 Jun 1964,174 min,"Adventure, Drama",Elia Kazan,Elia Kazan,"Stathis Giallelis, Frank Wolff, Elena Karam",A young Greek man stops at nothing to secure a passage to America.,English,United States,Won 1 Oscar. 7 wins & 12 nominations total,https://m.media-amazon.com/images/M/MV5BMGM5MjQ1ZDEtNTk1YS00YjBjLWEwMWEtNWNmMDlkZjUxZWUzXkEyXkFqcGc@._V1_SX300.jpg,72,7.7,"6,419",N/A,N/A,True,,1964-06-17,6.0,1964.0,174.0,7.7,72.0,6419.0,
1963.0,Cleopatra,Walter Wanger,1963 (36th),1963 (36th),1963.0,36.0,,Cleopatra,1934.0,Cleopatra,1934,05 Oct 1934,100 min,"Biography, Drama, History",Cecil B. DeMille,"Waldemar Young, Vincent Lawrence, Bartlett Cormack","Claudette Colbert, Warren William, Henry Wilcoxon","The man-hungry Queen of Egypt leads Julius Caesar and Marc Antony astray, amid scenes of DeMillean splendor.",English,United States,Won 1 Oscar. 2 wins & 4 nominations total,https://m.media-amazon.com/images/M/MV5BMjgzMTgwNTI1M15BMl5BanBnXkFtZTgwMTgxNjk3MjE@._V1_SX300.jpg,N/A,6.8,"4,787",N/A,N/A,True,,1934-10-05,10.0,1934.0,100.0,6.8,,4787.0,
1963.0,Cleopatra,Walter Wanger,1963 (36th),1963 (36th),1963.0,36.0,,Cleopatra,1963.0,Cleopatra,1963,31 Jul 1963,320 min,"Biography, Drama, History","Joseph L. Mankiewicz, Rouben Mamoulian","Joseph L. Mankiewicz, Ranald MacDougall, Sidney Buchman","Elizabeth Taylor, Richard Burton, Rex Harrison",Queen Cleopatra VII of Egypt experiences both triumph and tragedy as she attempts to resist the imperial ambitions of Rome.,English,"Switzerland, United Kingdom, United States",Won 4 Oscars. 7 wins & 13 nominations total,https://m.media-amazon.com/images/M/MV5BNDM0NzA2MTUtZTVhOC00MDYxLTk2MWMtNTY2ZjkyN2U5ZjM0XkEyXkFqcGc@._V1_SX300.jpg,60,7.0,"40,521","$57,777,778",N/A,True,,1963-07-31,7.0,1963.0,320.0,7.0,60.0,40521.0,57777778.0
1963.0,How the West Was Won,Bernard Smith,1963 (36th),1963 (36th),1963.0,36.0,,How the West Was Won,1963.0,,,,,,,,,,,,,,,,,,,False,Movie not found!,,,,,,,,
1963.0,Lilies of the Field,Ralph Nelson,1963 (36th),1963 (36th),1963.0,36.0,,Lilies of the Field,1963.0,Lilies of the Field,1963,05 Jul 1963,94 min,"Comedy, Drama",Ralph Nelson,"James Poe, William E. Barrett","Sidney Poitier, Lilia Skala, Lisa Mann",A travelling handyman becomes the answer to the prayers of nuns who wish to build a chapel in the desert.,"English, German, Spanish",United States,Won 1 Oscar. 13 wins & 13 nominations total,https://m.media-amazon.com/images/M/MV5BOGM4NTg1ZGEtMzNjZC00Zjg2LWJjMDUtY2MzM2MxN2NmMTYyXkEyXkFqcGc@._V1_SX300.jpg,61,7.5,"14,784",N/A,N/A,True,,1963-07-05,7.0,1963.0,94.0,7.5,61.0,14784.0,
1964.0,My Fair Lady,Jack L. Warner,1964 (37th),1964 (37th),1964.0,37.0,,My Fair Lady,1964.0,My Fair Lady,1964,25 Dec 1964,170 min,"Drama, Family, Musical",George Cukor,"Alan Jay Lerner, George Bernard Shaw","Audrey Hepburn, Rex Harrison, Stanley Holloway","In 1910s London, snobbish phonetics professor Henry Higgins agrees to a wager that he can make a crude flower girl, Eliza Doolittle, presentable in high society.",English,United States,Won 8 Oscars. 26 wins & 13 nominations total,https://m.media-amazon.com/images/M/MV5BNmMxZmFjZmQtMDRiOC00MDQxLTlhNDktZTkxMmRiYWM1ZDUzXkEyXkFqcGc@._V1_SX300.jpg,95,7.7,"105,962","$72,560,711",N/A,True,,1964-12-25,12.0,1964.0,170.0,7.7,95.0,105962.0,72560711.0
1964.0,Becket,Hal B. Wallis,1964 (37th),1964 (37th),1964.0,37.0,,Becket,1964.0,Becket,1964,11 Mar 1964,148 min,"Biography, Drama, History",Peter Glenville,"Jean Anouilh, Lucienne Hill, Edward Anhalt","Richard Burton, Peter O'Toole, John Gielgud","King Henry II of England comes to terms with his affection for his close friend and confidant Thomas Becket, who finds his true honor by observing God's divine will rather than the King's.","English, Latin, Welsh","United Kingdom, United States",Won 1 Oscar. 14 wins & 23 nominations total,https://m.media-amazon.com/images/M/MV5BZWIyNGI0MWMtOTkyMi00MzYyLWJkOWQtY2E1ZjgxNjQwNWZjXkEyXkFqcGc@._V1_SX300.jpg,68,7.7,"16,848","$149,327",N/A,True,,1964-03-11,3.0,1964.0,148.0,7.7,68.0,16848.0,149327.0
1964.0,Dr. Strangelove or: How I Learned to Stop Worrying and Love the Bomb,Stanley Kubrick,1964 (37th),1964 (37th),1964.0,37.0,,Dr. Strangelove or: How I Learned to Stop Worrying and Love the Bomb,1964.0,Dr. Strangelove or: How I Learned to Stop Worrying and Love the Bomb,1964,29 Jan 1964,95 min,"Comedy, War",Stanley Kubrick,"Stanley Kubrick, Terry Southern, Peter George","Peter Sellers, George C. Scott, Sterling Hayden","A mentally unstable American general orders a hydrogen bomb attack on the Soviet Union, triggering a path to global nuclear holocaust that a war room full of politicians and generals frantically tries to stop.","English, Russian",United Kingdom,Nominated for 4 Oscars. 14 wins & 11 nominations total,https://m.media-amazon.com/images/M/MV5BMjFjYzBlOTktMTI2OS00ZWVhLTgxMDUtNzAwODY2NmI3YTAzXkEyXkFqcGc@._V1_SX300.jpg,97,8.3,"549,187","$9,440,272",N/A,True,,1964-01-29,1.0,1964.0,95.0,8.3,97.0,549187.0,9440272.0
1964.0,Mary Poppins,Walt Disney and Bill Walsh,1964 (37th),1964 (37th),1964.0,37.0,,Mary Poppins,1964.0,Mary Poppins,1964,18 Jun 1965,139 min,"Comedy, Family, Fantasy",Robert Stevenson,"Bill Walsh, Don DaGradi, P.L. Travers","Julie Andrews, Dick Van Dyke, David Tomlinson","In turn of the century London, a magical nanny employs music and adventure to help two neglected children become closer to their father.",English,United States,Won 5 Oscars. 23 wins & 17 nominations total,https://m.media-amazon.com/images/M/MV5BNThiNjgzMTYtZjUzMC00YTVlLTg4MDItMmFjMDIwYjg4ZDAwXkEyXkFqcGc@._V1_SX300.jpg,88,7.8,"197,040","$102,272,727",N/A,True,,1965-06-18,6.0,1965.0,139.0,7.8,88.0,197040.0,102272727.0
1964.0,Zorba the Greek,Michael Cacoyannis,1964 (37th),1964 (37th),1964.0,37.0,,Zorba the Greek,1964.0,Zorba the Greek,1964,14 Dec 1964,142 min,"Comedy, Drama",Michael Cacoyannis,"Nikos Kazantzakis, Michael Cacoyannis","Anthony Quinn, Alan Bates, Irene Papas",A reserved English writer travelling to Crete on a matter of business finds his life changed forever when he meets the gregarious Alexis Zorba.,"English, Greek","United States, Greece",Won 3 Oscars. 8 wins & 16 nominations total,https://m.media-amazon.com/images/M/MV5BYWFhMGZmZTUtMzI0Yi00MzUwLTkzOWUtMWRmODZmYWY5YWE3XkEyXkFqcGc@._V1_SX300.jpg,N/A,7.6,"24,844",N/A,N/A,True,,1964-12-14,12.0,1964.0,142.0,7.6,,24844.0,
1965.0,The Sound of Music,Robert Wise,1965 (38th),1965 (38th),1965.0,38.0,,The Sound of Music,1965.0,The Sound of Music,1965,01 Apr 1965,174 min,"Biography, Drama, Family",Robert Wise,"Georg Hurdalek, Howard Lindsay, Russel Crouse","Julie Andrews, Christopher Plummer, Eleanor Parker",A young novice is sent by her convent in 1930s Austria to become a governess to the seven children of a widowed naval officer.,"English, German",United States,Won 5 Oscars. 19 wins & 13 nominations total,https://m.media-amazon.com/images/M/MV5BYWJhYmU4MjQtZDJhYi00ZGVjLTlkNTEtNzkzNGVjOWQ3MjcwXkEyXkFqcGc@._V1_SX300.jpg,63,8.1,"289,128","$160,888,776",N/A,True,,1965-04-01,4.0,1965.0,174.0,8.1,63.0,289128.0,160888776.0
1965.0,Darling,Joseph Janni,1965 (38th),1965 (38th),1965.0,38.0,,Darling,1965.0,Darling,1965,03 Aug 1965,128 min,"Drama, Romance",John Schlesinger,"Frederic Raphael, John Schlesinger, Joseph Janni","Julie Christie, Dirk Bogarde, Laurence Harvey",Beautiful but amoral model Diana Scott sleeps her way to the top of the London fashion scene at the height of the Swinging Sixties.,English,United Kingdom,Won 3 Oscars. 17 wins & 8 nominations total,https://m.media-amazon.com/images/M/MV5BMTgzMGM0ZWItOWE1OC00MGEzLWE3ZjEtYWE3MTM1YjAwNjdkXkEyXkFqcGc@._V1_SX300.jpg,N/A,7.0,"8,382",N/A,N/A,True,,1965-08-03,8.0,1965.0,128.0,7.0,,8382.0,
1965.0,Doctor Zhivago,Carlo Ponti,1965 (38th),1965 (38th),1965.0,38.0,,Doctor Zhivago,1965.0,Doctor Zhivago,1965,31 Dec 1965,197 min,"Drama, Romance, War",David Lean,"Boris Pasternak, Robert Bolt","Omar Sharif, Julie Christie, Geraldine Chaplin","The life of a Russian physician and poet who, although married to another, falls in love with a political activist's wife and experiences hardship during World War I and then the October Revolution.","English, Russian, French","Italy, United Kingdom, United States",Won 5 Oscars. 22 wins & 13 nominations total,https://m.media-amazon.com/images/M/MV5BNWQyZGNmZWItNjc0OS00M2YyLWJkZmYtZWNlNDE2MzMwYzUzXkEyXkFqcGc@._V1_SX300.jpg,69,7.9,"86,506","$111,721,910",N/A,True,,1965-12-31,12.0,1965.0,197.0,7.9,69.0,86506.0,111721910.0
1965.0,Ship of Fools,Stanley Kramer,1965 (38th),1965 (38th),1965.0,38.0,,Ship of Fools,1965.0,Ship of Fools,1965,01 Oct 1965,149 min,"Drama, Romance, War",Stanley Kramer,"Katherine Anne Porter, Abby Mann","Vivien Leigh, Simone Signoret, José Ferrer",A varied group of passengers boarding a ship bound for pre-WWII Germany represents a microcosm of early-1930s society.,"English, German, Spanish",United States,Won 2 Oscars. 5 wins & 13 nominations total,https://m.media-amazon.com/images/M/MV5BZDkzNzcyZmEtMWZjMy00ZmJmLThmNDItM2U1NTdkNTY4NmEzXkEyXkFqcGc@._V1_SX300.jpg,N/A,7.1,"7,151",N/A,N/A,True,,1965-10-01,10.0,1965.0,149.0,7.1,,7151.0,
1965.0,A Thousand Clowns,Fred Coe,1965 (38th),1965 (38th),1965.0,38.0,,A Thousand Clowns,1965.0,A Thousand Clowns,1965,09 Sep 1966,118 min,"Comedy, Drama, Romance",Fred Coe,Herb Gardner,"Jason Robards, Barbara Harris, Martin Balsam","A middle-aged iconoclast, doggedly avoiding the tedium of employment and conventional life, faces the prospect of losing custody of his young ward.",English,United States,Won 1 Oscar. 4 wins & 7 nominations total,https://m.media-amazon.com/images/M/MV5BOGJiOGZmZmYtODg3Yi00ZTk1LWI3OWUtYTMzNDQwOWM2MTEwXkEyXkFqcGc@._V1_SX300.jpg,N/A,7.3,"3,847","$5,232,000",N/A,True,,1966-09-09,9.0,1966.0,118.0,7.3,,3847.0,5232000.0
1966.0,A Man for All Seasons,Fred Zinnemann,1966 (39th),1966 (39th),1966.0,39.0,,A Man for All Seasons,1966.0,A Man for All Seasons,1966,16 Dec 1966,120 min,"Biography, Drama, History",Fred Zinnemann,Robert Bolt,"Paul Scofield, Wendy Hiller, Robert Shaw",The story of English statesman Sir Thomas More who defied King Henry VIII after Henry rejected the Roman Catholic Church in order to obtain a divorce and remarry.,"English, Latin, Spanish, French",United Kingdom,Won 6 Oscars. 34 wins & 9 nominations total,https://m.media-amazon.com/images/M/MV5BNjBmMWM0MDQtY2JlNy00NjVkLWE1MjgtMTFmYmRkOTc1ZmNlXkEyXkFqcGc@._V1_SX300.jpg,72,7.7,"39,905",N/A,N/A,True,,1966-12-16,12.0,1966.0,120.0,7.7,72.0,39905.0,
1966.0,Alfie,Lewis Gilbert,1966 (39th),1966 (39th),1966.0,39.0,,Alfie,1966.0,Alfie,1966,24 Aug 1966,114 min,"Comedy, Drama",Lewis Gilbert,Bill Naughton,"Michael Caine, Shelley Winters, Millicent Martin",Unrepentant ladies' man Alfie Elkins gradually begins to understand the consequences of his lifestyle in 1960s London.,English,United Kingdom,Nominated for 5 Oscars. 8 wins & 22 nominations total,https://m.media-amazon.com/images/M/MV5BNjI1NGFmODQtNTUyNS00Yzk5LWE1MmMtOWZhODA3ZTY1YzAxXkEyXkFqcGc@._V1_SX300.jpg,70,7.0,"16,160",N/A,N/A,True,,1966-08-24,8.0,1966.0,114.0,7.0,70.0,16160.0,
1966.0,"The Russians Are Coming, the Russians Are Coming",Norman Jewison,1966 (39th),1966 (39th),1966.0,39.0,,"The Russians Are Coming, the Russians Are Coming",1966.0,The Russians Are Coming the Russians Are Coming,1966,25 May 1966,126 min,"Comedy, War",Norman Jewison,"William Rose, Nathaniel Benchley","Carl Reiner, Eva Marie Saint, Alan Arkin","Without hostile intent, a Soviet submarine runs aground off New England. Men are sent for a boat, but many villagers go into a tizzy, risking bloodshed.","English, Russian",United States,Nominated for 4 Oscars. 5 wins & 13 nominations total,https://m.media-amazon.com/images/M/MV5BYjFjYzViMjctZDI1ZS00ZTAwLWEyYzktMzU3NzQ0ZmFiZjA3XkEyXkFqcGc@._V1_SX300.jpg,69,7.0,"10,570",N/A,N/A,True,,1966-05-25,5.0,1966.0,126.0,7.0,69.0,10570.0,
1966.0,The Sand Pebbles,Robert Wise,1966 (39th),1966 (39th),1966.0,39.0,,The Sand Pebbles,1966.0,The Sand Pebbles,1966,20 Dec 1966,182 min,"Adventure, Drama, Romance",Robert Wise,"Richard McKenna, Robert Anderson","Steve McQueen, Richard Attenborough, Richard Crenna","In 1926, a U.S. Naval engineer gets assigned to a gunboat on a rescue mission in war-torn China.","English, Mandarin",United States,Nominated for 8 Oscars. 2 wins & 21 nominations total,https://m.media-amazon.com/images/M/MV5BNTFiMmNmZTctNGQ5ZC00MDEyLTg4NGQtYTQ5NWI3ZGIxZjdhXkEyXkFqcGc@._V1_SX300.jpg,N/A,7.5,"17,295",N/A,N/A,True,,1966-12-20,12.0,1966.0,182.0,7.5,,17295.0,
1966.0,Who's Afraid of Virginia Woolf?,Ernest Lehman,1966 (39th),1966 (39th),1966.0,39.0,,Who's Afraid of Virginia Woolf?,1966.0,Who's Afraid of Virginia Woolf?,1966,22 Jun 1966,131 min,Drama,Mike Nichols,"Ernest Lehman, Edward Albee","Elizabeth Taylor, Richard Burton, George Segal","A middle-aged New England associate professor and his wife, with the help of alcohol, use their young guests to fuel anguish and emotional pain towards each other over the course of a distressing night.","English, Latin, Spanish",United States,Won 5 Oscars. 22 wins & 26 nominations total,https://m.media-amazon.com/images/M/MV5BOGY5YWJlMjUtNWI4Zi00NTExLWIwMDUtNGJkOTM0MzliNjE4XkEyXkFqcGc@._V1_SX300.jpg,75,8.0,"83,779","$28,000,000",N/A,True,,1966-06-22,6.0,1966.0,131.0,8.0,75.0,83779.0,28000000.0
1967.0,In the Heat of the Night,Walter Mirisch,1967 (40th),1967 (40th),1967.0,40.0,,In the Heat of the Night,1967.0,In the Heat of the Night,1967,02 Aug 1967,110 min,"Drama, Mystery, Thriller",Norman Jewison,"Stirling Silliphant, John Ball","Sidney Poitier, Rod Steiger, Warren Oates","A black Philadelphia police detective is mistakenly suspected of a local murder while passing through a racially hostile Mississippi town, and after being cleared is reluctantly asked by the police chief to investigate the case.",English,United States,Won 5 Oscars. 23 wins & 16 nominations total,https://m.media-amazon.com/images/M/MV5BMjVmYjZkMmQtYmFjZC00MmFhLTg5NzMtNzgzODE0YjQwNzlmXkEyXkFqcGc@._V1_SX300.jpg,76,7.9,"87,737",N/A,N/A,True,,1967-08-02,8.0,1967.0,110.0,7.9,76.0,87737.0,
1967.0,Bonnie and Clyde,Warren Beatty,1967 (40th),1967 (40th),1967.0,40.0,,Bonnie and Clyde,1967.0,Bonnie and Clyde,1967,14 Aug 1967,111 min,"Action, Biography, Crime",Arthur Penn,"David Newman, Robert Benton, Robert Towne","Warren Beatty, Faye Dunaway, Michael J. Pollard","Bored waitress Bonnie Parker falls in love with an ex-con named Clyde Barrow and together they start a violent crime spree through the country, stealing cars and robbing banks.",English,United States,Won 2 Oscars. 22 wins & 29 nominations total,https://m.media-amazon.com/images/M/MV5BYWI3ZmM1NmEtMDk4Yi00MzYzLTk0MDctYWJlZjY4MGViNDFiXkEyXkFqcGc@._V1_SX300.jpg,86,7.7,"126,617",N/A,N/A,True,,1967-08-14,8.0,1967.0,111.0,7.7,86.0,126617.0,
1967.0,Doctor Dolittle,Arthur P. Jacobs,1967 (40th),1967 (40th),1967.0,40.0,,Doctor Dolittle,1967.0,Doctor Dolittle,1967,19 Dec 1967,152 min,"Adventure, Comedy, Family",Richard Fleischer,"Hugh Lofting, Leslie Bricusse","Rex Harrison, Samantha Eggar, Anthony Newley","After the animal communicating veterinarian goes too far for his clientele, he and his friends escape their hometown to the sea in search of the Great Pink Sea Snail.",English,United States,Won 2 Oscars. 6 wins & 15 nominations total,https://m.media-amazon.com/images/M/MV5BMjMxOTM3NzU4M15BMl5BanBnXkFtZTgwNDU0MDUxMDE@._V1_SX300.jpg,34,6.2,"10,559",N/A,N/A,True,,1967-12-19,12.0,1967.0,152.0,6.2,34.0,10559.0,
1967.0,The Graduate,Lawrence Turman,1967 (40th),1967 (40th),1967.0,40.0,,The Graduate,1967.0,The Graduate,1967,21 Dec 1967,106 min,"Comedy, Drama, Romance",Mike Nichols,"Calder Willingham, Buck Henry, Charles Webb","Dustin Hoffman, Anne Bancroft, Katharine Ross",A disillusioned college graduate finds himself torn between his older lover and her daughter.,English,United States,Won 1 Oscar. 22 wins & 17 nominations total,https://m.media-amazon.com/images/M/MV5BMTQ0ODc4MDk4Nl5BMl5BanBnXkFtZTcwMTEzNzgzNA@@._V1_SX300.jpg,83,8.0,"301,414","$104,945,305",N/A,True,,1967-12-21,12.0,1967.0,106.0,8.0,83.0,301414.0,104945305.0
1967.0,Guess Who's Coming to Dinner,Stanley Kramer,1967 (40th),1967 (40th),1967.0,40.0,,Guess Who's Coming to Dinner,1967.0,Guess Who's Coming to Dinner,1967,12 Dec 1967,108 min,"Comedy, Drama",Stanley Kramer,William Rose,"Spencer Tracy, Sidney Poitier, Katharine Hepburn",A White couple's attitudes are challenged when their daughter introduces them to her Black fiancé.,"English, Latin",United States,Won 2 Oscars. 11 wins & 25 nominations total,https://m.media-amazon.com/images/M/MV5BNmMwNjRiYTUtNjM5Yy00ZDk2LWJiZjEtYjRjMzVmYmM1OGQ5XkEyXkFqcGc@._V1_SX300.jpg,63,7.8,"52,283","$56,666,667",N/A,True,,1967-12-12,12.0,1967.0,108.0,7.8,63.0,52283.0,56666667.0
1968.0,Oliver!,John Woolf,1968 (41st),1968 (41st),1968.0,41.0,,Oliver!,1968.0,Oliver!,1968,27 Sep 1968,153 min,"Drama, Family, Musical",Carol Reed,"Lionel Bart, Vernon Harris, Charles Dickens","Mark Lester, Ron Moody, Shani Wallis","After being sold to the mortician Sowerberry, young orphan Oliver Twist runs away and meets a group of boys trained to be pickpockets by their elderly mentor Fagin in 1830s London in this musical based on Charles Dickens' Oliver T...",English,United Kingdom,Won 5 Oscars. 13 wins & 25 nominations total,https://m.media-amazon.com/images/M/MV5BNjRhYmVlZGItYzgxMS00MzI3LTgzZjctNTcxMGRiN2E5ZGYwXkEyXkFqcGc@._V1_SX300.jpg,74,7.4,"43,327",N/A,N/A,True,,1968-09-27,9.0,1968.0,153.0,7.4,74.0,43327.0,
1968.0,Funny Girl,Ray Stark,1968 (41st),1968 (41st),1968.0,41.0,,Funny Girl,1968.0,Funny Girl,1968,19 Sep 1968,151 min,"Biography, Comedy, Drama",William Wyler,Isobel Lennart,"Barbra Streisand, Omar Sharif, Kay Medford","The life of Fanny Brice, famed comedienne and entertainer of the early 1900s: her rise to fame as a Ziegfeld Girl, her subsequent career, and her personal life, particularly her relationship with Nick Arnstein.",English,United States,Won 1 Oscar. 8 wins & 16 nominations total,https://m.media-amazon.com/images/M/MV5BZjg4NTA3MTktNDRkMy00MjlhLTlmYTgtNWExY2ViN2QxMWJhXkEyXkFqcGc@._V1_SX300.jpg,88,7.4,"27,194","$52,223,306",N/A,True,,1968-09-19,9.0,1968.0,151.0,7.4,88.0,27194.0,52223306.0
1968.0,The Lion in Winter,Martin Poll,1968 (41st),1968 (41st),1968.0,41.0,,The Lion in Winter,1968.0,The Lion in Winter,1968,30 Oct 1968,134 min,"Biography, Drama, History",Anthony Harvey,James Goldman,"Peter O'Toole, Katharine Hepburn, Anthony Hopkins","1183 A.D.: King Henry II's three sons all want to inherit the throne, but he won't commit to a choice. When he allows his imprisoned wife Eleanor of Aquitaine out for a Christmas visit, they all variously plot to force him into a ...","English, French, Latin",United Kingdom,Won 3 Oscars. 16 wins & 18 nominations total,https://m.media-amazon.com/images/M/MV5BMTkzNzYyMzA5N15BMl5BanBnXkFtZTgwODcwODQ3MDI@._V1_SX300.jpg,N/A,7.8,"36,568","$18,177",N/A,True,,1968-10-30,10.0,1968.0,134.0,7.8,,36568.0,18177.0
1968.0,"Rachel, Rachel",Paul Newman,1968 (41st),1968 (41st),1968.0,41.0,,"Rachel, Rachel",1968.0,"Rachel, Rachel",1968,26 Aug 1968,101 min,"Drama, Romance",Paul Newman,"Stewart Stern, Margaret Laurence","Joanne Woodward, James Olson, Kate Harrington","Rachel is a lonely school teacher who lives with her mother. When a man from the big city asks her out, she starts thinking about where she wants her life to go.",English,United States,Nominated for 4 Oscars. 7 wins & 11 nominations total,https://m.media-amazon.com/images/M/MV5BYWQ0N2QyNDMtODU3NS00MzZiLWFiNGEtYzZmMjA0NWJmMWMwXkEyXkFqcGc@._V1_SX300.jpg,74,7.1,"4,126",N/A,N/A,True,,1968-08-26,8.0,1968.0,101.0,7.1,74.0,4126.0,
1968.0,Romeo and Juliet,Anthony Havelock-Allan and John Brabourne,1968 (41st),1968 (41st),1968.0,41.0,,Romeo and Juliet,1936.0,Romeo and Juliet,1936,03 Sep 1936,125 min,"Drama, Romance",George Cukor,"William Shakespeare, Talbot Jennings","Norma Shearer, Leslie Howard, John Barrymore",Young love is poisoned by a generations long feud between two noble families.,English,United States,Nominated for 4 Oscars. 1 win & 5 nominations total,https://m.media-amazon.com/images/M/MV5BYzA3ODU4MzYtYzA1YS00OWE1LTg1NzgtMTNhY2EwODc1OTVhXkEyXkFqcGc@._V1_SX300.jpg,N/A,6.5,"2,275",N/A,N/A,True,,1936-09-03,9.0,1936.0,125.0,6.5,,2275.0,
1968.0,Romeo and Juliet,Anthony Havelock-Allan and John Brabourne,1968 (41st),1968 (41st),1968.0,41.0,,Romeo and Juliet,1968.0,Romeo and Juliet,1968,08 Oct 1968,138 min,"Drama, Romance",Franco Zeffirelli,"William Shakespeare, Franco Brusati, Masolino D'Amico","Leonard Whiting, Olivia Hussey, John McEnery","When two young members of feuding families meet, forbidden love ensues.","English, French","United Kingdom, Italy",Won 2 Oscars. 16 wins & 16 nominations total,https://m.media-amazon.com/images/M/MV5BMDAxNjRiZmEtOWUxYy00YjVmLWFlMDItZmQxOWI3MjI2Y2NmXkEyXkFqcGc@._V1_SX300.jpg,69,7.6,"36,409",N/A,Dino de Laurentiis Cinematografica,True,,1968-10-08,10.0,1968.0,138.0,7.6,69.0,36409.0,
1969.0,Midnight Cowboy,Jerome Hellman,1969 (42nd),1969 (42nd),1969.0,42.0,,Midnight Cowboy,1969.0,Midnight Cowboy,1969,25 May 1969,113 min,Drama,John Schlesinger,"Waldo Salt, James Leo Herlihy","Dustin Hoffman, Jon Voight, Sylvia Miles","A naive hustler travels from Texas to New York City to seek personal fortune, finding a new friend in the process.","English, Italian",United States,Won 3 Oscars. 28 wins & 16 nominations total,https://m.media-amazon.com/images/M/MV5BY2QyNDQ4ZGQtOTFlYy00NDVjLWI5NTEtNTBmYTA5OTI0ODYyXkEyXkFqcGc@._V1_SX300.jpg,79,7.8,"130,799","$44,785,053",N/A,True,,1969-05-25,5.0,1969.0,113.0,7.8,79.0,130799.0,44785053.0
1969.0,Anne of the Thousand Days,Hal B. Wallis,1969 (42nd),1969 (42nd),1969.0,42.0,,Anne of the Thousand Days,1969.0,Anne of the Thousand Days,1969,18 Dec 1969,145 min,"Biography, Drama, History",Charles Jarrott,"Bridget Boland, John Hale, Richard Sokolove","Richard Burton, Geneviève Bujold, Irene Papas","King Henry VIII of England discards one wife, Catharine of Aragon, who has failed to produce a male heir, in favor of the young and beautiful Anne Boleyn.",English,United Kingdom,Won 1 Oscar. 6 wins & 16 nominations total,https://m.media-amazon.com/images/M/MV5BYTQ0Njg2YWItNzNlZC00NzU3LWI0MmYtMGMxNjFlYmFkOTIxXkEyXkFqcGc@._V1_SX300.jpg,N/A,7.4,"8,649","$2,068,232",N/A,True,,1969-12-18,12.0,1969.0,145.0,7.4,,8649.0,2068232.0
1969.0,Butch Cassidy and the Sundance Kid,John Foreman,1969 (42nd),1969 (42nd),1969.0,42.0,,Butch Cassidy and the Sundance Kid,1969.0,Butch Cassidy and the Sundance Kid,1969,24 Sep 1969,110 min,"Adventure, Biography, Crime",George Roy Hill,William Goldman,"Paul Newman, Robert Redford, Katharine Ross","In 1890s Wyoming, Butch Cassidy and The Sundance Kid lead a band of outlaws. When a train robbery goes wrong, they find themselves on the run with a posse hard on their heels..","English, Spanish","United States, Mexico",Won 4 Oscars. 22 wins & 15 nominations total,https://m.media-amazon.com/images/M/MV5BMTkyMTM2NDk5Nl5BMl5BanBnXkFtZTgwNzY1NzEyMDE@._V1_SX300.jpg,66,8.0,"237,821","$102,308,889",N/A,True,,1969-09-24,9.0,1969.0,110.0,8.0,66.0,237821.0,102308889.0
1969.0,"Hello, Dolly!",Ernest Lehman,1969 (42nd),1969 (42nd),1969.0,42.0,,"Hello, Dolly!",1969.0,"Hello, Dolly!",1969,16 Dec 1969,146 min,"Adventure, Comedy, Musical",Gene Kelly,"Michael Stewart, Thornton Wilder, Ernest Lehman","Barbra Streisand, Walter Matthau, Michael Crawford","Matchmaker Dolly Levi travels to Yonkers to find a partner for ""half-a-millionaire"" Horace Vandergelder, convincing his niece, his niece's intended, and his two clerks to travel to New York City along the way.",English,United States,Won 3 Oscars. 4 wins & 13 nominations total,https://m.media-amazon.com/images/M/MV5BODk3MmYzOWYtNmQzZC00NTQyLWJjM2EtMDEzZjc3NDYxYWI4XkEyXkFqcGc@._V1_SX300.jpg,51,7.0,"18,075","$400,881",N/A,True,,1969-12-16,12.0,1969.0,146.0,7.0,51.0,18075.0,400881.0
