year,film,producers,year_raw,ceremony_year_raw,film_release_year,ceremony_number,winner_flag,film_clean,lookup_year,omdb_title,omdb_year,released,runtime,genre,director,writer,actors,plot,language,country,awards,poster,metascore,imdb_rating,imdb_votes,box_office,production,response_flag,error_msg,released_dt,release_month,release_year_omdb,runtime_min,imdb_rating_num,metascore_num,imdb_votes_num,box_office_num
1984.0,Places in the Heart,Arlene Donovan,1984 (57th),1984 (57th),1984.0,57.0,,Places in the Heart,1984.0,Places in the Heart,1984,05 Oct 1984,111 min,Drama,Robert Benton,Robert Benton,"Sally Field, Lindsay Crouse, Ed Harris","In north Texas in the 1930s, a widow with two small children tries to save her small 40-acre farm with the help of a blind boarder and an itinerant black handyman.",English,United States,Won 2 Oscars. 13 wins & 14 nominations total,https://m.media-amazon.com/images/M/MV5BZDcxNjk4NzUtMzgyOC00YzliLWEzMTctZmE5ZWVkN2ExNzU2XkEyXkFqcGc@._V1_SX300.jpg,70,7.4,"14,106","$34,901,614",N/A,True,,1984-10-05,10.0,1984.0,111.0,7.4,70.0,14106.0,34901614.0
1984.0,A Soldier's Story,"Norman Jewison, Ronald L. Schwary, and Patrick J. Palmer",1984 (57th),1984 (57th),1984.0,57.0,,A Soldier's Story,1984.0,A Soldier's Story,1984,02 Nov 1984,101 min,"Crime, Drama, Mystery",Norman Jewison,Charles Fuller,"Howard E. Rollins Jr., Adolph Caesar, Art Evans",An African-American officer investigates a murder in a racially charged situation in World War II.,English,United States,Nominated for 3 Oscars. 6 wins & 9 nominations total,https://m.media-amazon.com/images/M/MV5BNTY1NjhkMjMtNTQwZi00MjkzLThhNmItYTIwOTg3ODlkYzBkXkEyXkFqcGc@._V1_SX300.jpg,66,7.2,"12,176","$21,821,347",N/A,True,,1984-11-02,11.0,1984.0,101.0,7.2,66.0,12176.0,21821347.0
1985.0,Out of Africa,Sydney Pollack,1985 (58th),1985 (58th),1985.0,58.0,,Out of Africa,1985.0,Out of Africa,1985,20 Dec 1985,161 min,"Biography, Drama, Romance",Sydney Pollack,"Karen Blixen, Judith Thurman, Errol Trzebinski","Meryl Streep, Robert Redford, Klaus Maria Brandauer","In 20th-century colonial Kenya, a Danish baroness/plantation owner has a passionate love affair with a free-spirited big-game hunter.","English, Swahili, Arabic",United States,Won 7 Oscars. 30 wins & 31 nominations total,https://m.media-amazon.com/images/M/MV5BOWQ5MGI3NWYtMmVjNS00OWIzLWEzMGQtMGZhMzY3NjI2YjhiXkEyXkFqcGc@._V1_SX300.jpg,69,7.1,"91,765","$87,071,205",N/A,True,,1985-12-20,12.0,1985.0,161.0,7.1,69.0,91765.0,87071205.0
1985.0,The Color Purple,"Steven Spielberg, Kathleen Kennedy, Frank Marshall, and Quincy Jones",1985 (58th),1985 (58th),1985.0,58.0,,The Color Purple,1985.0,The Color Purple,1985,07 Feb 1986,154 min,Drama,Steven Spielberg,"Menno Meyjes, Alice Walker","Danny Glover, Whoopi Goldberg, Oprah Winfrey","A tale spanning forty years in the life of Celie, an African-American woman living in the South who survives incredible abuse and bigotry.",English,United States,Nominated for 11 Oscars. 14 wins & 25 nominations total,https://m.media-amazon.com/images/M/MV5BM2MyZjBlMGItNThkMi00YWExLThlZmUtZmI2MGM3YWE3YTY1XkEyXkFqcGc@._V1_SX300.jpg,78,7.7,"102,275","$98,467,863",N/A,True,,1986-02-07,2.0,1986.0,154.0,7.7,78.0,102275.0,98467863.0
1985.0,Kiss of the Spider Woman,David Weisman,1985 (58th),1985 (58th),1985.0,58.0,,Kiss of the Spider Woman,1985.0,Kiss of the Spider Woman,1985,26 Jul 1985,120 min,Drama,Hector Babenco,"Manuel Puig, Leonard Schrader","William Hurt, Raul Julia, Sonia Braga",A gay man and a political prisoner are together in a prison. The gay man narrates the stories of two fake movies and his own life.,"English, French, Portuguese, German","Brazil, United States",Won 1 Oscar. 14 wins & 12 nominations total,https://m.media-amazon.com/images/M/MV5BNzk4NTY2MWQtNDljZS00YjFkLTg5YmYtN2MxMWJiNmU2YWY0XkEyXkFqcGc@._V1_SX300.jpg,80,7.3,"19,184","$17,005,229",N/A,True,,1985-07-26,7.0,1985.0,120.0,7.3,80.0,19184.0,17005229.0
1985.0,Prizzi's Honor,John Foreman,1985 (58th),1985 (58th),1985.0,58.0,,Prizzi's Honor,1985.0,Prizzi's Honor,1985,14 Jun 1985,130 min,"Comedy, Crime, Drama",John Huston,"Richard Condon, Janet Roach","Jack Nicholson, Kathleen Turner, Robert Loggia",Two professional assassins fall in love.,"English, Italian, Spanish",United States,Won 1 Oscar. 27 wins & 25 nominations total,https://m.media-amazon.com/images/M/MV5BMjFiYjUzZWEtZmQxMy00NzI1LWJiZjUtNjA4MTczOTY2MjM0XkEyXkFqcGc@._V1_SX300.jpg,84,6.7,"27,793","$26,657,534",N/A,True,,1985-06-14,6.0,1985.0,130.0,6.7,84.0,27793.0,26657534.0
1985.0,Witness,Edward S. Feldman,1985 (58th),1985 (58th),1985.0,58.0,,Witness,1985.0,Witness,1985,08 Feb 1985,112 min,"Crime, Drama, Romance",Peter Weir,"William Kelley, Pamela Wallace, Earl W. Wallace","Harrison Ford, Kelly McGillis, Lukas Haas","While protecting an Amish boy - the sole witness to a brutal murder - and his mother, a detective is forced to seek refuge within their rural community when his own life is threatened.","English, German",United States,Won 2 Oscars. 13 wins & 28 nominations total,https://m.media-amazon.com/images/M/MV5BNDcyNjU5MWMtNDZiYy00Yjc4LWE4YjItMTA5ODBlOGU1NzRhXkEyXkFqcGc@._V1_SX300.jpg,76,7.3,"113,048","$68,706,993",N/A,True,,1985-02-08,2.0,1985.0,112.0,7.3,76.0,113048.0,68706993.0
1986.0,Platoon,Arnold Kopelson,1986 (59th),1986 (59th),1986.0,59.0,,Platoon,1986.0,Platoon,1986,19 Dec 1986,120 min,"Drama, War",Oliver Stone,Oliver Stone,"Charlie Sheen, Tom Berenger, Willem Dafoe","Chris Taylor, a neophyte recruit in Vietnam, finds himself caught in a battle of wills between two sergeants, one good and the other evil. A shrewd examination of the brutality of war and the duality of man in conflict.","English, Vietnamese","United States, United Kingdom",Won 4 Oscars. 24 wins & 16 nominations total,https://m.media-amazon.com/images/M/MV5BZjE4YjllODAtZGMxZS00Mjg2LThkOWUtZjNkMjQ5YThiNDU4XkEyXkFqcGc@._V1_SX300.jpg,92,8.1,"466,757","$138,530,565",N/A,True,,1986-12-19,12.0,1986.0,120.0,8.1,92.0,466757.0,138530565.0
1986.0,Children of a Lesser God,Burt Sugarman and Patrick J. Palmer,1986 (59th),1986 (59th),1986.0,59.0,,Children of a Lesser God,1986.0,Children of a Lesser God,1986,31 Oct 1986,119 min,"Drama, Romance",Randa Haines,"Mark Medoff, Hesper Anderson, James Carrington","William Hurt, Marlee Matlin, Piper Laurie","A new speech teacher at a school for the deaf falls in love with the janitor, a deaf woman speechless by choice.","English, American Sign ",United States,Won 1 Oscar. 6 wins & 13 nominations total,https://m.media-amazon.com/images/M/MV5BMjY3YjQyMjAtOGI2ZC00NDljLWJlN2QtYjNiYTMxZjIxMzQ0XkEyXkFqcGc@._V1_SX300.jpg,80,7.2,"19,009","$31,853,080",N/A,True,,1986-10-31,10.0,1986.0,119.0,7.2,80.0,19009.0,31853080.0
1986.0,Hannah and Her Sisters,Robert Greenhut,1986 (59th),1986 (59th),1986.0,59.0,,Hannah and Her Sisters,1986.0,Hannah and Her Sisters,1986,14 Mar 1986,107 min,"Comedy, Drama",Woody Allen,Woody Allen,"Mia Farrow, Dianne Wiest, Michael Caine","Between two Thanksgivings two years apart, Hannah's husband falls in love with her sister Lee, while her hypochondriac ex-husband rekindles his relationship with her sister Holly.",English,United States,Won 3 Oscars. 27 wins & 28 nominations total,https://m.media-amazon.com/images/M/MV5BNTdmOWViYWMtMjVjNC00MDI5LTk3ZmEtM2MxMzFkMzQ5NzNjXkEyXkFqcGc@._V1_SX300.jpg,90,7.8,"81,156","$40,084,041",N/A,True,,1986-03-14,3.0,1986.0,107.0,7.8,90.0,81156.0,40084041.0
1986.0,The Mission,Fernando Ghia and David Puttnam,1986 (59th),1986 (59th),1986.0,59.0,,The Mission,1986.0,The Mission,1986,31 Oct 1986,125 min,"Adventure, Drama, History",Roland Joffé,Robert Bolt,"Robert De Niro, Jeremy Irons, Ray McAnally",Eighteenth-century Spanish Jesuits try to protect a remote South American tribe in danger of falling under the rule of pro-slavery Portugal.,"English, Guarani, Spanish, Latin","United Kingdom, France, United States",Won 1 Oscar. 15 wins & 27 nominations total,https://m.media-amazon.com/images/M/MV5BODcxMDJiMzQtNzVkYS00ZDI3LWEzYmEtY2NiYTIzZWQzYzRlXkEyXkFqcGc@._V1_SX300.jpg,55,7.4,"70,499","$17,218,023",N/A,True,,1986-10-31,10.0,1986.0,125.0,7.4,55.0,70499.0,17218023.0
1986.0,A Room with a View,Ismail Merchant,1986 (59th),1986 (59th),1986.0,59.0,,A Room with a View,1986.0,,,,,,,,,,,,,,,,,,,False,Movie not found!,,,,,,,,
1987.0,The Last Emperor,Jeremy Thomas,1987 (60th),1987 (60th),1987.0,60.0,,The Last Emperor,1987.0,The Last Emperor,1987,15 Apr 1988,163 min,"Biography, Drama, History",Bernardo Bertolucci,"Enzo Ungari, Mark Peploe, Bernardo Bertolucci","John Lone, Joan Chen, Peter O'Toole",Bernardo Bertolucci's Oscar-winning dramatization of China's eleventh and final monarch of the Qing dynasty: Emperor Puyi.,"English, Mandarin, Japanese, French","China, Italy, United Kingdom, France",Won 9 Oscars. 58 wins & 20 nominations total,https://m.media-amazon.com/images/M/MV5BYjIxYWFiMDgtZTgyMy00MjFiLWIyMmEtNGIyZjc1NTRlMzQ3XkEyXkFqcGc@._V1_SX300.jpg,76,7.7,"118,875","$43,984,230",N/A,True,,1988-04-15,4.0,1988.0,163.0,7.7,76.0,118875.0,43984230.0
1987.0,Broadcast News,James L. Brooks,1987 (60th),1987 (60th),1987.0,60.0,,Broadcast News,1987.0,Broadcast News,1987,25 Dec 1987,133 min,"Comedy, Drama, Romance",James L. Brooks,James L. Brooks,"William Hurt, Albert Brooks, Holly Hunter","A high-strung news producer finds herself in a love triangle between a talented but self-doubting reporter and a charming new anchor, who embodies the growing trivialization of news that she is determined to fight against.","English, Spanish, French, German",United States,Nominated for 7 Oscars. 15 wins & 23 nominations total,https://m.media-amazon.com/images/M/MV5BMGVhZjNiYmUtMTAwYS00ZjQ0LWIyNGItNTU1OWNjYjA4ZDE5XkEyXkFqcGc@._V1_SX300.jpg,84,7.3,"35,553","$51,249,404",N/A,True,,1987-12-25,12.0,1987.0,133.0,7.3,84.0,35553.0,51249404.0
1987.0,Fatal Attraction,Stanley R. Jaffe and Sherry Lansing,1987 (60th),1987 (60th),1987.0,60.0,,Fatal Attraction,1987.0,Fatal Attraction,1987,18 Sep 1987,119 min,"Drama, Thriller",Adrian Lyne,James Dearden,"Michael Douglas, Glenn Close, Anne Archer",A married man's one-night stand comes back to haunt him when that lover begins to stalk him and his family.,English,United States,Nominated for 6 Oscars. 10 wins & 24 nominations total,https://m.media-amazon.com/images/M/MV5BMTYxY2MxZGUtYWMwYi00YTI4LWE5MTItZjRiZDIzNzdhNWY3XkEyXkFqcGc@._V1_SX300.jpg,67,6.9,"109,013","$156,645,693",N/A,True,,1987-09-18,9.0,1987.0,119.0,6.9,67.0,109013.0,156645693.0
1987.0,Hope and Glory,John Boorman,1987 (60th),1987 (60th),1987.0,60.0,,Hope and Glory,1987.0,Hope and Glory,1987,19 Feb 1988,113 min,"Comedy, Drama, Romance",John Boorman,John Boorman,"Sarah Miles, David Hayman, Sebastian Rice-Edwards",A young boy living on the outskirts of London comes of age during the uncertain days of World War II.,English,"United Kingdom, United States",Nominated for 5 Oscars. 16 wins & 29 nominations total,https://m.media-amazon.com/images/M/MV5BZDIyMTBjNGEtNDAxMy00ODI4LTgwZWYtMTBjYzFmNTY3ZTdiXkEyXkFqcGc@._V1_SX300.jpg,86,7.3,"15,387","$10,021,120",N/A,True,,1988-02-19,2.0,1988.0,113.0,7.3,86.0,15387.0,10021120.0
1987.0,Moonstruck,Patrick J. Palmer and Norman Jewison,1987 (60th),1987 (60th),1987.0,60.0,,Moonstruck,1987.0,Moonstruck,1987,15 Jan 1988,102 min,"Comedy, Drama, Romance",Norman Jewison,John Patrick Shanley,"Cher, Nicolas Cage, Olympia Dukakis","Loretta Castorini, a bookkeeper from Brooklyn, New York, finds herself in a difficult situation when she falls for the brother of the man she has agreed to marry.","English, Italian, Latin",United States,Won 3 Oscars. 18 wins & 19 nominations total,https://m.media-amazon.com/images/M/MV5BZjdiMjI1MTQtMWIzNC00OTg2LWI5NjItYTBiMTYzMmIxYmNjXkEyXkFqcGc@._V1_SX300.jpg,83,7.2,"76,420","$80,640,528",N/A,True,,1988-01-15,1.0,1988.0,102.0,7.2,83.0,76420.0,80640528.0
1988.0,Rain Man,Mark Johnson,1988 (61st),1988 (61st),1988.0,61.0,,Rain Man,1988.0,Rain Man,1988,16 Dec 1988,133 min,Drama,Barry Levinson,"Barry Morrow, Ron Bass","Dustin Hoffman, Tom Cruise, Valeria Golino","After a selfish L.A. yuppie learns his estranged father left a fortune to an autistic-savant brother in Ohio that he didn't know existed, he absconds with his brother and sets out across the country, hoping to gain a larger inheri...","English, Italian",United States,Won 4 Oscars. 27 wins & 26 nominations total,https://m.media-amazon.com/images/M/MV5BZDUzODNkNGUtNzJjNi00ODFlLTkzMzktMGNkOTIwYWM2YTQzXkEyXkFqcGc@._V1_SX300.jpg,65,8.0,"581,331","$172,825,435",N/A,True,,1988-12-16,12.0,1988.0,133.0,8.0,65.0,581331.0,172825435.0
1988.0,The Accidental Tourist,"Lawrence Kasdan, Charles Okun, and Michael Grillo",1988 (61st),1988 (61st),1988.0,61.0,,The Accidental Tourist,1988.0,The Accidental Tourist,1988,06 Jan 1989,121 min,"Comedy, Drama, Romance",Lawrence Kasdan,"Anne Tyler, Frank Galati, Lawrence Kasdan","William Hurt, Kathleen Turner, Geena Davis",An emotionally distant writer of travel guides must carry on with his life after his son is killed and his marriage crumbles.,English,United States,Won 1 Oscar. 4 wins & 11 nominations total,https://m.media-amazon.com/images/M/MV5BMzRiYzY2NGEtZTdmNi00MjRjLTljYzUtZDc0NDJhOTU0ZjUyXkEyXkFqcGc@._V1_SX300.jpg,52,6.7,"18,401","$32,632,093",N/A,True,,1989-01-06,1.0,1989.0,121.0,6.7,52.0,18401.0,32632093.0
1988.0,Dangerous Liaisons,Norma Heyman and Hank Moonjean,1988 (61st),1988 (61st),1988.0,61.0,,Dangerous Liaisons,1988.0,Dangerous Liaisons,1988,24 Feb 1989,119 min,"Drama, Romance",Stephen Frears,"Christopher Hampton, Choderlos de Laclos","Glenn Close, John Malkovich, Michelle Pfeiffer",A scheming widow and her manipulative ex-lover make a bet regarding the corruption of a recently married woman.,English,"United Kingdom, United States",Won 3 Oscars. 21 wins & 23 nominations total,https://m.media-amazon.com/images/M/MV5BYmJkMzZhNzktYjgyYi00N2ZjLTgxN2EtN2JhOGY1NTE3ZWY0XkEyXkFqcGc@._V1_SX300.jpg,74,7.5,"79,291","$34,670,720",N/A,True,,1989-02-24,2.0,1989.0,119.0,7.5,74.0,79291.0,34670720.0
1988.0,Mississippi Burning,Frederick Zollo and Robert F. Colesberry,1988 (61st),1988 (61st),1988.0,61.0,,Mississippi Burning,1988.0,Mississippi Burning,1988,27 Jan 1989,128 min,"Crime, Drama, Mystery",Alan Parker,Chris Gerolmo,"Gene Hackman, Willem Dafoe, Frances McDormand",Two FBI agents with wildly different styles arrive in Mississippi to investigate the disappearance of three civil rights activists.,English,United States,Won 1 Oscar. 17 wins & 25 nominations total,https://m.media-amazon.com/images/M/MV5BZDgwNTljYmMtYmQyNi00MmEwLTk0NzMtZDJmZDIzZmQ4MzQ2XkEyXkFqcGc@._V1_SX300.jpg,65,7.8,"125,709","$34,603,943",N/A,True,,1989-01-27,1.0,1989.0,128.0,7.8,65.0,125709.0,34603943.0
1988.0,Working Girl,Douglas Wick,1988 (61st),1988 (61st),1988.0,61.0,,Working Girl,1988.0,Working Girl,1988,21 Dec 1988,113 min,"Comedy, Drama, Romance",Mike Nichols,Kevin Wade,"Melanie Griffith, Harrison Ford, Sigourney Weaver","When a secretary's idea is stolen by her boss, she seizes an opportunity to steal it back by pretending she has her boss' job.",English,United States,Won 1 Oscar. 9 wins & 18 nominations total,https://m.media-amazon.com/images/M/MV5BYzZhNGFlNGYtMjgyMi00YmZiLWFjNjktZGIzYjkxM2YyZWJjXkEyXkFqcGc@._V1_SX300.jpg,73,6.8,"66,977","$63,779,477",N/A,True,,1988-12-21,12.0,1988.0,113.0,6.8,73.0,66977.0,63779477.0
1989.0,Driving Miss Daisy,Richard D. Zanuck and Lili Fini Zanuck,1989 (62nd),1989 (62nd),1989.0,62.0,,Driving Miss Daisy,1989.0,Driving Miss Daisy,1989,26 Jan 1990,99 min,"Comedy, Drama",Bruce Beresford,Alfred Uhry,"Morgan Freeman, Jessica Tandy, Dan Aykroyd",An old Jewish woman and her African-American chauffeur in the American South have a relationship that grows and improves over the years.,"English, Hebrew",United States,Won 4 Oscars. 22 wins & 24 nominations total,https://m.media-amazon.com/images/M/MV5BN2M2MWUyZmQtMmI4Yi00NGE2LWFiZmEtNDZkZmYxNWRlM2Y1XkEyXkFqcGc@._V1_SX300.jpg,81,7.3,"123,093","$106,593,296",N/A,True,,1990-01-26,1.0,1990.0,99.0,7.3,81.0,123093.0,106593296.0
1989.0,Born on the Fourth of July,A. Kitman Ho and Oliver Stone,1989 (62nd),1989 (62nd),1989.0,62.0,,Born on the Fourth of July,1989.0,Born on the Fourth of July,1989,05 Jan 1990,145 min,"Biography, Drama, War",Oliver Stone,"Ron Kovic, Oliver Stone","Tom Cruise, Bryan Larkin, Raymond J. Barry","The biography of Ron Kovic. Paralyzed in the Vietnam war, he becomes an anti-war and pro-human rights political activist after feeling betrayed by the country for which he fought.","English, Spanish",United States,Won 2 Oscars. 15 wins & 26 nominations total,https://m.media-amazon.com/images/M/MV5BMTgwNDk5NTA0NF5BMl5BanBnXkFtZTgwMTkyMDUxMDE@._V1_SX300.jpg,75,7.2,"120,847","$70,001,698",N/A,True,,1990-01-05,1.0,1990.0,145.0,7.2,75.0,120847.0,70001698.0
1989.0,Dead Poets Society,"Steven Haft, Paul Junger Witt, and Tony Thomas",1989 (62nd),1989 (62nd),1989.0,62.0,,Dead Poets Society,1989.0,Dead Poets Society,1989,09 Jun 1989,128 min,"Comedy, Drama",Peter Weir,Tom Schulman,"Robin Williams, Robert Sean Leonard, Ethan Hawke","Maverick teacher John Keating returns in 1959 to the prestigious New England boys' boarding school where he was once a star student, using poetry to embolden his pupils to new heights of self-expression.","English, Latin, French",United States,Won 1 Oscar. 20 wins & 19 nominations total,https://m.media-amazon.com/images/M/MV5BMDYwNGVlY2ItMWYxMS00YjZiLWE5MTAtYWM5NWQ2ZWJjY2Q3XkEyXkFqcGc@._V1_SX300.jpg,79,8.1,"643,802","$95,860,116",N/A,True,,1989-06-09,6.0,1989.0,128.0,8.1,79.0,643802.0,95860116.0
1989.0,Field of Dreams,Lawrence Gordon and Charles Gordon,1989 (62nd),1989 (62nd),1989.0,62.0,,Field of Dreams,1989.0,Field of Dreams,1989,05 May 1989,107 min,"Drama, Family, Fantasy",Phil Alden Robinson,"W.P. Kinsella, Phil Alden Robinson","Kevin Costner, James Earl Jones, Ray Liotta","Iowa farmer Ray Kinsella is inspired by a voice he can't ignore to pursue a dream he can hardly believe. Supported by his wife, Ray begins the quest by turning his ordinary cornfield into a place where dreams can come true.",English,United States,Nominated for 3 Oscars. 9 wins & 14 nominations total,https://m.media-amazon.com/images/M/MV5BZTEwMGYzNDktOWEyMi00NTJjLWE5MGQtNmNlNDkxOTYyZDA5XkEyXkFqcGc@._V1_SX300.jpg,57,7.5,"138,012","$64,532,235",N/A,True,,1989-05-05,5.0,1989.0,107.0,7.5,57.0,138012.0,64532235.0
1989.0,My Left Foot,Noel Pearson,1989 (62nd),1989 (62nd),1989.0,62.0,,My Left Foot,1989.0,My Left Foot,1989,30 Mar 1990,103 min,"Biography, Drama",Jim Sheridan,"Shane Connaughton, Jim Sheridan, Christy Brown","Daniel Day-Lewis, Brenda Fricker, Alison Whelan","Christy Brown, born with cerebral palsy, learns to paint and write with his only controllable limb - his left foot.",English,"Ireland, United Kingdom",Won 2 Oscars. 23 wins & 20 nominations total,https://m.media-amazon.com/images/M/MV5BYzU2NDY0YzItOTVhNS00Yzk4LTg0ZTktNjFiZDJmZTgwMDYyXkEyXkFqcGc@._V1_SX300.jpg,97,7.8,"83,993","$14,743,391",N/A,True,,1990-03-30,3.0,1990.0,103.0,7.8,97.0,83993.0,14743391.0
1990.0,Dances With Wolves,Jim Wilson and Kevin Costner,1990 (63rd),1990 (63rd),1990.0,63.0,,Dances With Wolves,1990.0,Dances with Wolves,1990,21 Nov 1990,181 min,"Adventure, Drama, Western",Kevin Costner,Michael Blake,"Kevin Costner, Mary McDonnell, Graham Greene",A lieutenant assigned to a remote Civil War outpost starts questioning his purpose after making contact with a neighboring Sioux settlement.,"English, Sioux, Pawnee","United States, United Kingdom",Won 7 Oscars. 55 wins & 40 nominations total,https://m.media-amazon.com/images/M/MV5BMTY3OTI5NDczN15BMl5BanBnXkFtZTcwNDA0NDY3Mw@@._V1_SX300.jpg,72,8.0,"307,747","$184,208,848",N/A,True,,1990-11-21,11.0,1990.0,181.0,8.0,72.0,307747.0,184208848.0
1990.0,Awakenings,Walter F. Parkes and Lawrence Lasker,1990 (63rd),1990 (63rd),1990.0,63.0,,Awakenings,1990.0,Awakenings,1990,11 Jan 1991,121 min,"Biography, Drama",Penny Marshall,"Oliver Sacks, Steven Zaillian","Robert De Niro, Robin Williams, Julie Kavner",Dr. Sayer is a pioneering neurologist who wants to take a risk and give his patients who suffer from encephalitis a drug used for Parkinson's Disease. He tries it out on one man who miraculously wakes from his perpetual catatonic ...,English,United States,Nominated for 3 Oscars. 6 wins & 11 nominations total,https://m.media-amazon.com/images/M/MV5BZDUzOGQ4YTctNTY1OS00M2UzLWFjNzYtMGNlN2E5NDA2MGVkXkEyXkFqcGc@._V1_SX300.jpg,74,7.8,"171,002","$52,096,475",N/A,True,,1991-01-11,1.0,1991.0,121.0,7.8,74.0,171002.0,52096475.0
1990.0,Ghost,Lisa Weinstein,1990 (63rd),1990 (63rd),1990.0,63.0,,Ghost,1990.0,Ghost,1990,13 Jul 1990,126 min,"Drama, Fantasy, Romance",Jerry Zucker,Bruce Joel Rubin,"Patrick Swayze, Demi Moore, Tony Goldwyn","After a young man is murdered, his spirit stays behind to warn his lover of impending danger, with the help of a reluctant psychic.",English,United States,Won 2 Oscars. 18 wins & 24 nominations total,https://m.media-amazon.com/images/M/MV5BZjkwOWM2MWMtMWE1YS00MTBlLTg1ODctYTI3M2I0NGIxMGYyXkEyXkFqcGc@._V1_SX300.jpg,52,7.1,"251,803","$217,631,306",N/A,True,,1990-07-13,7.0,1990.0,126.0,7.1,52.0,251803.0,217631306.0
1990.0,The Godfather Part III,Francis Ford Coppola,1990 (63rd),1990 (63rd),1990.0,63.0,,The Godfather Part III,1990.0,The Godfather Part III,1990,25 Dec 1990,162 min,"Crime, Drama",Francis Ford Coppola,"Mario Puzo, Francis Ford Coppola","Al Pacino, Diane Keaton, Andy Garcia","Follows Michael Corleone, now in his 60s, as he seeks to free his family from crime and find a suitable successor to his empire.","English, Italian, German, Latin, Persian",United States,Nominated for 7 Oscars. 6 wins & 23 nominations total,https://m.media-amazon.com/images/M/MV5BMDVjODgzNTEtNjBiNS00ODBjLWEwZjUtMDljZTFhOTA4M2MxXkEyXkFqcGc@._V1_SX300.jpg,60,7.5,"451,848","$66,761,392",N/A,True,,1990-12-25,12.0,1990.0,162.0,7.5,60.0,451848.0,66761392.0
1990.0,Goodfellas,Irwin Winkler,1990 (63rd),1990 (63rd),1990.0,63.0,,Goodfellas,1990.0,Goodfellas,1990,21 Sep 1990,145 min,"Biography, Crime, Drama",Martin Scorsese,"Nicholas Pileggi, Martin Scorsese","Robert De Niro, Ray Liotta, Joe Pesci","The story of Henry Hill and his life in the mafia, covering his relationship with his wife Karen and his mob partners Jimmy Conway and Tommy DeVito.","English, Italian, Hebrew, Yiddish",United States,Won 1 Oscar. 44 wins & 38 nominations total,https://m.media-amazon.com/images/M/MV5BN2E5NzI2ZGMtY2VjNi00YTRjLWI1MDUtZGY5OWU1MWJjZjRjXkEyXkFqcGc@._V1_SX300.jpg,92,8.7,"1,378,825","$46,909,721",N/A,True,,1990-09-21,9.0,1990.0,145.0,8.7,92.0,1378825.0,46909721.0
1991.0,The Silence of the Lambs,"Edward Saxon, Kenneth Utt, and Ron Bozman",1991 (64th),1991 (64th),1991.0,64.0,,The Silence of the Lambs,1991.0,,,,,,,,,,,,,,,,,,,False,401 Client Error: Unauthorized for url: https://www.omdbapi.com/?t=The+Silence+of+the+Lambs&apikey=61670e4e&y=1991,,,,,,,,
1991.0,Beauty and the Beast,Don Hahn,1991 (64th),1991 (64th),1991.0,64.0,,Beauty and the Beast,1991.0,,,,,,,,,,,,,,,,,,,False,401 Client Error: Unauthorized for url: https://www.omdbapi.com/?t=Beauty+and+the+Beast&apikey=61670e4e&y=1991,,,,,,,,
1991.0,Bugsy,"Mark Johnson, Barry Levinson and Warren Beatty",1991 (64th),1991 (64th),1991.0,64.0,,Bugsy,1991.0,,,,,,,,,,,,,,,,,,,False,401 Client Error: Unauthorized for url: https://www.omdbapi.com/?t=Bugsy&apikey=61670e4e&y=1991,,,,,,,,
1991.0,JFK,A. Kitman Ho and Oliver Stone,1991 (64th),1991 (64th),1991.0,64.0,,JFK,1991.0,,,,,,,,,,,,,,,,,,,False,401 Client Error: Unauthorized for url: https://www.omdbapi.com/?t=JFK&apikey=61670e4e&y=1991,,,,,,,,
1991.0,The Prince of Tides,Barbra Streisand and Andrew Karsch,1991 (64th),1991 (64th),1991.0,64.0,,The Prince of Tides,1991.0,,,,,,,,,,,,,,,,,,,False,401 Client Error: Unauthorized for url: https://www.omdbapi.com/?t=The+Prince+of+Tides&apikey=61670e4e&y=1991,,,,,,,,
1992.0,Unforgiven,Clint Eastwood,1992 (65th),1992 (65th),1992.0,65.0,,Unforgiven,1992.0,,,,,,,,,,,,,,,,,,,False,401 Client Error: Unauthorized for url: https://www.omdbapi.com/?t=Unforgiven&apikey=61670e4e&y=1992,,,,,,,,
1992.0,The Crying Game,Stephen Woolley,1992 (65th),1992 (65th),1992.0,65.0,,The Crying Game,1992.0,,,,,,,,,,,,,,,,,,,False,401 Client Error: Unauthorized for url: https://www.omdbapi.com/?t=The+Crying+Game&apikey=61670e4e&y=1992,,,,,,,,
1992.0,A Few Good Men,"David Brown, Rob Reiner, and Andrew Scheinman",1992 (65th),1992 (65th),1992.0,65.0,,A Few Good Men,1992.0,,,,,,,,,,,,,,,,,,,False,401 Client Error: Unauthorized for url: https://www.omdbapi.com/?t=A+Few+Good+Men&apikey=61670e4e&y=1992,,,,,,,,
1992.0,Howards End,Ismail Merchant,1992 (65th),1992 (65th),1992.0,65.0,,Howards End,1992.0,,,,,,,,,,,,,,,,,,,False,401 Client Error: Unauthorized for url: https://www.omdbapi.com/?t=Howards+End&apikey=61670e4e&y=1992,,,,,,,,
1992.0,Scent of a Woman,Martin Brest,1992 (65th),1992 (65th),1992.0,65.0,,Scent of a Woman,1992.0,,,,,,,,,,,,,,,,,,,False,401 Client Error: Unauthorized for url: https://www.omdbapi.com/?t=Scent+of+a+Woman&apikey=61670e4e&y=1992,,,,,,,,
1993.0,Schindler's List,"Steven Spielberg, Gerald R. Molen, and Branko Lustig",1993 (66th),1993 (66th),1993.0,66.0,,Schindler's List,1993.0,,,,,,,,,,,,,,,,,,,False,401 Client Error: Unauthorized for url: https://www.omdbapi.com/?t=Schindler%27s+List&apikey=61670e4e&y=1993,,,,,,,,
1993.0,The Fugitive,Arnold Kopelson,1993 (66th),1993 (66th),1993.0,66.0,,The Fugitive,1993.0,,,,,,,,,,,,,,,,,,,False,401 Client Error: Unauthorized for url: https://www.omdbapi.com/?t=The+Fugitive&apikey=61670e4e&y=1993,,,,,,,,
1993.0,In the Name of the Father,Jim Sheridan,1993 (66th),1993 (66th),1993.0,66.0,,In the Name of the Father,1993.0,,,,,,,,,,,,,,,,,,,False,401 Client Error: Unauthorized for url: https://www.omdbapi.com/?t=In+the+Name+of+the+Father&apikey=61670e4e&y=1993,,,,,,,,
1993.0,The Piano,Jan Chapman,1993 (66th),1993 (66th),1993.0,66.0,,The Piano,1993.0,,,,,,,,,,,,,,,,,,,False,401 Client Error: Unauthorized for url: https://www.omdbapi.com/?t=The+Piano&apikey=61670e4e&y=1993,,,,,,,,
